{
  "schema_version": 1,
  "license": "Apache-2.0",
  "project": "fable-agent-orchestration",
  "description": "Public-clean database of Fable-style agent orchestration skills.",
  "clean_public_boundary": [
    "No private formulas or methodology names",
    "No private peer identities",
    "No private continuity-system details",
    "No third-party source dumps or reverse-engineering artifacts",
    "No raw session transcripts or bulky logs",
    "No keys, tokens, or secrets"
  ],
  "skills": [
    {
      "id": "fable-orchestrator",
      "path": "skills/fable-orchestrator/SKILL.md",
      "role": "outer-loop coordinator",
      "trigger": "large multi-change engagement that needs several agents and serialized merge control",
      "primary_gate": "one PR per invariant, independent review, current CI"
    },
    {
      "id": "autonomous-finish-loop",
      "path": "skills/autonomous-finish-loop/SKILL.md",
      "role": "turn-completion discipline",
      "trigger": "safe reversible work remains after a plan, tool event, CI event, or agent completion",
      "primary_gate": "real artifact or gate checked before final report; only external gates stop the turn"
    },
    {
      "id": "think-work-try",
      "path": "skills/think-work-try/SKILL.md",
      "role": "single-slice worker cycle",
      "trigger": "one delicate slice needs investigation, narrow implementation, and falsification proof",
      "primary_gate": "think hazards named, work narrow, try proof passes"
    },
    {
      "id": "one-slice-worker-cycle",
      "path": "skills/one-slice-worker-cycle/SKILL.md",
      "role": "single-slice implementation worker",
      "trigger": "correctness-critical slice requiring investigation, narrow build, and falsification",
      "primary_gate": "hazards named, narrow diff, fail-under-broken proof"
    },
    {
      "id": "two-critic-review-loop",
      "path": "skills/two-critic-review-loop/SKILL.md",
      "role": "separate verifier loop",
      "trigger": "an agent PR needs both proof validation and code review before merge",
      "primary_gate": "test critic and change critic both pass, then reviewer claims are verified"
    },
    {
      "id": "agent-pr-validator",
      "path": "skills/agent-pr-validator/SKILL.md",
      "role": "agent pull request validator",
      "trigger": "an agent-generated pull request or merged change needs validation",
      "primary_gate": "claim-to-diff mapping plus CI and test evidence"
    },
    {
      "id": "adversarial-reviewer",
      "path": "skills/adversarial-reviewer/SKILL.md",
      "role": "independent reviewer",
      "trigger": "load-bearing code, test, plan, or release claim needs refutation pressure",
      "primary_gate": "strongest real objection checked against current artifacts"
    },
    {
      "id": "task-relative-test-gate",
      "path": "skills/task-relative-test-gate/SKILL.md",
      "role": "test-ruler validator",
      "trigger": "a feature or fix is claimed working and generic green tests are insufficient",
      "primary_gate": "test fails under broken behavior and passes under fixed behavior"
    },
    {
      "id": "review-verifier",
      "path": "skills/review-verifier/SKILL.md",
      "role": "review verdict checker",
      "trigger": "a reviewer claims PASS or FIX_FIRST and the conductor must verify the verdict",
      "primary_gate": "spot-check load-bearing reviewer claims at current HEAD"
    },
    {
      "id": "orphaned-wip-adopter",
      "path": "skills/orphaned-wip-adopter/SKILL.md",
      "role": "stalled work salvage",
      "trigger": "a parallel worker left coherent uncommitted work in a stale worktree",
      "primary_gate": "stale confirmed, work exercised, rebased, finished, reviewed"
    },
    {
      "id": "agent-dispatch-packet",
      "path": "skills/agent-dispatch-packet/SKILL.md",
      "role": "delegated-agent packet builder",
      "trigger": "a conductor is about to delegate implementation, exploration, review, verification, or reconciliation work",
      "primary_gate": "role, scope, invariant, non-scope, fail-under-broken gate, output contract, and registry row are explicit"
    },
    {
      "id": "peer-review-packet",
      "path": "skills/peer-review-packet/SKILL.md",
      "role": "external review packet builder",
      "trigger": "a structural decision needs outside correlation without dumping a workspace",
      "primary_gate": "small OPSEC-clean decision packet and verified answer intake"
    },
    {
      "id": "fable-session-skill-miner",
      "path": "skills/fable-session-skill-miner/SKILL.md",
      "role": "agent-session skill miner",
      "trigger": "agent session logs, reports, or repeated orchestration mechanics may contain reusable skills",
      "primary_gate": "label stripped, closest existing skill compared, evidence anchored, procedure and validation gate explicit, OPSEC clean"
    },
    {
      "id": "external-workflow-adapter",
      "path": "skills/external-workflow-adapter/SKILL.md",
      "role": "third-party workflow adapter",
      "trigger": "adopting a workflow from another agent system, marketplace, or skill pack",
      "primary_gate": "useful primitives extracted, hidden assumptions rewritten, proof gates named"
    },
    {
      "id": "instruction-drift-control",
      "path": "skills/instruction-drift-control/SKILL.md",
      "role": "agent instruction drift controller",
      "trigger": "agent instruction files, skills, README sections, or fix logs risk drifting apart",
      "primary_gate": "canonical surface clear, duplicated rules removed or synced, fix-log entries evidence anchored"
    },
    {
      "id": "behavior-contract-harness",
      "path": "skills/behavior-contract-harness/SKILL.md",
      "role": "agent behavior contract harness",
      "trigger": "a behavior profile, output style, hook set, or eval loop claims to improve agent operating behavior",
      "primary_gate": "behavior named, enforcement surfaces classified, negative controls present, real-work telemetry or smoke evidence checked"
    },
    {
      "id": "phase-aware-engineering-ladder",
      "path": "skills/phase-aware-engineering-ladder/SKILL.md",
      "role": "phase-aware rigor calibrator",
      "trigger": "a prototype, MVP, production, security, recovery, or delivery decision needs the right amount of rigor",
      "primary_gate": "phase named, fixed floor preserved, scaled gates chosen, deferred gates tied to promotion triggers"
    },
    {
      "id": "investigate-before-fix",
      "path": "skills/investigate-before-fix/SKILL.md",
      "role": "pre-fix diagnosis verification",
      "trigger": "a fix is proposed for a diagnosed cause on a delicate, hot-path, security, or recovery change",
      "primary_gate": "the cause is reproduced at current HEAD before any fix, or the diagnosis is refuted"
    },
    {
      "id": "long-run-continuity",
      "path": "skills/long-run-continuity/SKILL.md",
      "role": "long-engagement continuity",
      "trigger": "a multi-PR run will cross a context or session boundary",
      "primary_gate": "queue, in-flight PRs, and open findings persisted to durable storage"
    },
    {
      "id": "easy-vs-right-check",
      "path": "skills/easy-vs-right-check/SKILL.md",
      "role": "self-honesty checkpoint",
      "trigger": "before a step that feels like progress, or before holding or stopping",
      "primary_gate": "the step attacks the real work not a proxy, and no premature stop while autonomous work remains"
    },
    {
      "id": "periodic-retrospect",
      "path": "skills/periodic-retrospect/SKILL.md",
      "role": "periodic self-review",
      "trigger": "on a stall, and at intervals regardless",
      "primary_gate": "repeated patterns named, dropped threads recovered, value alignment re-checked"
    },
    {
      "id": "seal-both-types",
      "path": "skills/seal-both-types/SKILL.md",
      "role": "type-construction safety",
      "trigger": "a typed contract treats possession of a value as proof it passed a check",
      "primary_gate": "both accepted and reject types sealed against external construction"
    }
  ]
}
